number_new,number,drksId,pruefer_original,pruefer_DC,cities_lead,cities_lead_corrected,manual_validation_cities_lead,Publication identified in which step,publication_DOI,publication_URL,article_yes_no,publication_date,unsure_about_publ_yes_no,reason,other_comments,title,firstDrksPublishDate,startDate,startDate_plannedActual,studyEnd,intervention.category0,intervention.value0,intervention.category1,intervention.value1,intervention.category2,intervention.value2,address.type0,address.affiliation0,address.firstname0,address.lastname0,address.type1,address.affiliation1,address.firstname1,address.lastname1,targetSize,recruitmentStatus,investorInitiated,monoMultiCentric,publication.category0,publication.type0,publication.value0,publication.category1,publication.type1,publication.value1,publication.category2,publication.type2,publication.value2,publication.category3,publication.type3,publication.value3,publication.category4,publication.type4,publication.value4
54,192,DRKS00007697,TB,HK,Halle,Halle,Halle,3,10.1055/s-0042-100952,https://www.thieme-connect.com/products/ejournals/abstract/10.1055/s-0042-100952,yes,11.04.2016,no,,,Simple Improvement of Cardiovascular Health and Cognitive Function in Elderly by Intermittant Tai Chi Training.,2015-01-14,2013-03-12,Actual,2014-06-30,Arm 1,Conventional cardiac rehabilitation sports (60min once weekly for 12 months),Arm 2,Tai Chi Training (modified Heart Sports after modification of the East Asian martial arts style - so-called shadow boxing.) (60min once weekly for 12 months),NA,NA,Primary Sponsor,Universitätsklinikum Halle (Saale),[---]*,[---]*,Contact for Scientific Queries,Universitätsklinikum Halle (Saale),Jochen,Schröder,42,"Recruiting complete, follow-up complete",yes,Monocenter trial,NA,NA,NA,NA,NA,NA,NA,NA,NA,NA,NA,NA,NA,NA,NA
55,205,DRKS00008002,TB,HK,Hamburg,Hamburg,Hamburg,8,,https://www.researchgate.net/publication/282868582_Psychometrische_Messung_von_Einstellungen_gegenuber_psychologischen_Online-Interventionen_bei_depressiven_Personen_und_Psychotherapeuten,,,,,,Efficacy of a psychological online intervention for people with anxiety symptoms,2015-04-10,2014-07-29,Actual,2015-04-08,Arm 1,"The web-based intervention program weekly scheduled modules that are based on cognitive-behavioral methods. Each module requires about  one hour to complete. A video moderation leads through the program. The program also includes interactive exercises and practice sheets, illustrations, photographs, animations and audios. Technical support is provided by the novego team.",Arm 2,Arm 2: Waitlist control condition (care as usual),NA,NA,Primary Sponsor,"AG Klinische Neuropsychologie,Klinik für Psychiatrie und Psychotherapie,Universitätsklinikum Hamburg Eppendorf",Steffen,Moritz,Contact for Scientific Queries,"AG Klinische Neuropsychologie,Klinik für Psychiatrie und Psychotherapie,Universitätsklinik Hamburg Eppendorf",Johanna,Schröder,180,"Recruiting complete, follow-up complete",yes,Monocenter trial,NA,NA,NA,NA,NA,NA,NA,NA,NA,NA,NA,NA,NA,NA,NA
57,233,DRKS00003442,TB,HK,Heidelberg,Heidelberg,Heidelberg,3,10.1007/s00406-018-0929-8,https://link.springer.com/article/10.1007/s00406-018-0929-8,yes,28.07.2018,no,,,Behavioral and neural effects of mothers´history of childhood abuse on the interaction with their child,2012-07-04,2012-07-23,Actual,2014-12-31,Arm 1,"Parent-Child-Interaction-Therapy (Hembree-Kigin et al., 1995)",Arm 2,"Individual stress coping training (modified after Kaluza, 2011)",NA,NA,Primary Sponsor,Klinik für Allgemeine Psychiatrie<br/>Universitätsklinikum Heidelberg,Sabine,Herpertz,Contact for Scientific Queries,Klinik für Allgemeine Psychiatrie,Katja,Bertsch,90,"Recruiting complete, follow-up complete",yes,Monocenter trial,NA,NA,NA,NA,NA,NA,NA,NA,NA,NA,NA,NA,NA,NA,NA
59,268,DRKS00007817,TB,HK,Homburg,Homburg,Homburg,8,,https://publikationen.sulb.uni-saarland.de/bitstream/20.500.11880/28044/1/Auswirkungen%20der%20neuen%20Therapie.pdf,,,,,,"Probiotic supplementation in patients with chronic liver disease, resulting from the hepatitis C virus",2015-02-16,2013-07-10,Actual,2016-04-17,Arm 1,"The intervention group receives the probiotic strains (lactobacillus helveticus and Bifidobacterium Longum) p.o. once a day for 60 days. At 30 and 60 days, patients will be assessed for severity of depressive and stress symptoms using the BDI-II and the PSS.",Arm 2,"The control group receives an identical placebo p.o. once a day for 60 days.<br/>At 30 and 60 days, patients will be assessed for severity of depressive and stress symptoms using the BDI-II and the PSS.",NA,NA,Primary Sponsor,"Lallemand Health Solutions, Institute Rosell Inc.",[---]*,[---]*,Contact for Scientific Queries,"Saarland University Medical Center, Department of Internal Medicine II",Caroline,Stokes,30,Recruiting stopped after recruiting started,yes,Monocenter trial,NA,NA,NA,NA,NA,NA,NA,NA,NA,NA,NA,NA,NA,NA,NA
60,278,DRKS00011492,TB,HK,Jena,Jena,Jena,3,10.1007/s00337-015-0084-5,https://link.springer.com/article/10.1007%2Fs00337-015-0084-5,yes,13.01.2016,yes,"Only partial results are reported. Since no further publication was found and only results from the pilot phase are explicitly announced here, I would not count publication. ",,Multimodal complex treatment in a subgroup of patients with vertebral pain syndroms,2017-01-11,2013-08-08,Actual,2016-01-20,Arm 1,patients with chronic back pain with differnent grades of chronicity (MPSS)<br/><br/>multimodal treatment OPS code 8-977<br/><br/>Multimodal nonsurgical complex treatment of the musculoskeletal system<br/>- interdisciplinary diagnostics and treatment<br/>- under specialist treatment line of at least 12 days <br/>simultaneous use of 5 diagnostic methods provided<br/>- neuro-orthopedic structure diagnostics <br/>- manual medical functional diagnostics<br/>- pain diagnostics<br/>- apparatus diagnostics under functional pathological aspects<br/>- psychodiagnostics<br/>to apply accordingly at least 3 methods of the following Treatment processes:<br/>- manual therapy and physiotherapy on a neurophysiological basis<br/>- medical training therapy<br/>- physical therapy<br/>- relaxation techniques<br/><br/>with a treatment density of at least 30 active and passive individual services on at least 12 days from both groups<br/>,NA,NA,NA,NA,Primary Sponsor,ANOA – Krankenhaus GmbH,[---]*,[---]*,Contact for Scientific Queries,"Universitätsklinikum Jena, Institut für Physiotherapie",Ulrich C,Smolenski,181,"Recruiting complete, follow-up complete",yes,Multicenter trial,NA,NA,NA,NA,NA,NA,NA,NA,NA,NA,NA,NA,NA,NA,NA
24,380,DRKS00005200,NR,HK,Munich,LMU,Munich,3,10.1093/schbul/sbw041,https://www.ncbi.nlm.nih.gov/pmc/articles/PMC4988747/,yes,20.04.2016,no,,,transcranial random noise stimulation for the treatment cognitive symptoms in the cluster of negative syndrome in schizophrenia.,2013-08-20,2013-10-01,Actual,2016-10-30,Arm 1,"active transcranial random noise stimulation. 20 min duration/intervention, 10 interventions in two weeks. technical aspects: High frequency (hf; 100-640 Hz), current strength 2 mA, offset at 1 mA.",Arm 2,"sham transcranial random noise stimulation. 20 min duration/intervention, 10 interventions in two weeks, technical aspects: high frequency (hf; 100-640 Hz), current strength 2 mA, offset at 1 mA.",NA,NA,Primary Sponsor,"Klinik für Psychiatrie, Psychotherapie und Psychosomatik der LMU München",Ulrich,Palm,Contact for Scientific Queries,Klinik und Poliklinik für Psychiatrie und Psychotherapie,Ulrich,Palm,30,"Recruiting complete, follow-up complete",yes,Monocenter trial,Paper,http://www.schres-journal.com/article/S0920-9964(13)00149-7/abstract,Transcranial random noise stimulation for the treatment of negative symptoms in schizophrenia,NA,NA,NA,NA,NA,NA,NA,NA,NA,NA,NA,NA
375,381,DRKS00005258,NR,HK,Munich,LMU,Munich,8,,https://www.google.com/url?sa=t&rct=j&q=&esrc=s&source=web&cd=&ved=2ahUKEwiR4rG2taztAhUJlxQKHZzEDSIQFjAAegQIBRAC&url=https%3A%2F%2Fwww.drks.de%2Fdrks_web%2FAttachmentDownstreamServlet%3FID%3Dad526ea0-694c-42e9-8ebb-35f6509a4338%26LOCALE%3Den%26FILENAME%3DEAT2TREAT_Ergebnisbericht_1.0_051017.pdf&usg=AOvVaw2b48XKusy1d1ohJMyn-jjc,no,,yes,"The document (link) contains the results, but cannot be considered a publication. The publication ""in preparation"" was not found.",,Pharmacological treatment of episodic ataxie type 2: Comparison of efficacy of 4-aminopyridine sustained release  (Fampyra®) and acetazolamid (Acemit®) versus placebo,2013-08-29,2013-07-26,Actual,2016-10-06,Arm 1,"Fampyra (sustained release tablets 4-Aminopyridin) 10 mg, oral, bid for 12 weeks followed by 4 weeks wash out",Arm 2,"Acemit (Acetazolamid) 250 mg, oral,  tid for 12 weeks, followed by 4 weeks wash out",Arm 3,"corresponding placebo in double dummy design, oral, bid or tid for 12 weeks",Primary Sponsor,"Klinikum der Universität München, Campus Großhadern",[---]*,[---]*,Contact for Scientific Queries,Klinikum der LMU München - Großhadern Deutsches Schwindel- und Gleichgewichtszentrum (IFB),Michael,Strupp,30,"Recruiting complete, follow-up complete",yes,Monocenter trial,NA,NA,NA,NA,NA,NA,NA,NA,NA,NA,NA,NA,NA,NA,NA
11,423,DRKS00010918,SW,HK,Schleswig-Holstein,Schleswig-Holstein,Schleswig-Holstein,3,10.1088/1361-6579/ab668f,https://iopscience.iop.org/article/10.1088/1361-6579/ab668f,yes,05.02.2020,no,,,Investigation of the functionality of the WELCOME-Vest in healthy volunteers without respiratory disease,2017-01-11,2017-01-12,Actual,2017-11-30,Arm 1,"It will be investigated whether the WELCOME-Weste by means of its integrated sensors generates signals that are plausible as well as in the physiological range for ECG, EIT, SpO 2, lung and heart murmurs and physical activity in healthy subjects. For this purpose the investigation is being conducted during the perfomance of breathing techniques, which patients with lung disease have to perform as part of their control examinations and during movements, which are being executed on a day-to-day basis (e.g. walking, lying down, sitting).",NA,NA,NA,NA,Primary Sponsor,Universitätsklinikum Schleswig-Holstein Campus Kiel,[---]*,[---]*,Contact for Scientific Queries,Klinik für Anästhesiologie und Operative Intensivmedizin,Barbara,Vogt,50,"Recruiting complete, follow-up complete",yes,Monocenter trial,NA,NA,NA,NA,NA,NA,NA,NA,NA,NA,NA,NA,NA,NA,NA
65,16,DRKS00007685,HK,EN,Bochum Duisburg,Bochum Duisburg,,3,10.1038/s41390-020-01114-w ,https://pubmed.ncbi.nlm.nih.gov/32919388/,yes,12.09.2020,no,,,Promoting academic resilience in preterm infants with adaptive computerized training - a multi-center randomised controlled trial,2015-01-13,2015-04-27,Actual,2017-12-20,Arm 1,"Adaptive mathematical training (intervention), daily (10-15 min) for 5 weeks.",Arm 2,"Cogmed adaptive working memory training (active control group), daily (25-30 min) for 5 weeks.",NA,NA,Primary Sponsor,"Ruhr-Universität Bochum, Fakultät für Psychologie, Arbeitseinheit Entwicklungspsychologie",Julia,Jäkel,Contact for Scientific Queries,"Universitätsklinikum Essen, Oberärztin und Prüfärztin der Klinik für Kinderheilkunde I, Neonatologie",Britta,Hüning,80,"Recruiting complete, follow-up complete",yes,Multicenter trial,NA,NA,NA,NA,NA,NA,NA,NA,NA,NA,NA,NA,NA,NA,NA
74,78,DRKS00011325,HK,EN,Düsseldorf,Düsseldorf,,3,10.1016/j.ejpb.2020.03.018 ,https://pubmed.ncbi.nlm.nih.gov/32348882/,yes,01.06.2020,no,,,"A Randomized, Single-dose, Cross-over Study to Investigate the Acceptability of an Orodispersible Film Compared to Syrup in Neonates and Infants",2016-11-21,2017-02-20,Actual,2017-04-24,Arm 1,Each patient is assigned to one of the three age groups depending on the age. The sequence of the two administrations (orodispersible film and glucose sirup) is randomised. <br/><br/>Patients of age group 1 (2-28 days) recieve one orodispersible film with a drink of choice.<br/><br/>Patients of age group 2 (29 days-5 months inclusive) recieve one orodispersible film with a drink of choice.<br/><br/>Patients of age group 3 (6-12 months inclusive) recieve one orodispersible film with a drink of choice.<br/>,Arm 2,Patients of age group 1 receive 0.5 ml Glucose sirup.<br/><br/>Patients of age group 2 receive 3 ml Glucose sirup.<br/><br/>Patients of age group 3 receive 3 ml Glucose sirup.,NA,NA,Primary Sponsor,"Klinik für Allgemeine Pädiatrie, Neonatologie und Kinderkardiologie, Universitätsklinik Düsseldorf",[---]*,[---]*,Contact for Scientific Queries,Heinrich-Heine Universität Düsseldorf,Viviane,Klingmann,150,"Recruiting complete, follow-up complete",yes,Monocenter trial,NA,NA,NA,NA,NA,NA,NA,NA,NA,NA,NA,NA,NA,NA,NA
76,82,DRKS00005301,HK,EN,Erlangen,Erlangen,,2,10.25593/978-3-96147-095-2,https://doi.org/10.25593/978-3-96147-095-2,no,14.05.2018,no,,"Dissertation: ""Quantitative Estimation of Total Body Water Loss During Physical Exercise""",Noninvasive determination of total body water during sports,2013-09-16,2013-09-10,Actual,2014-02-21,Arm 1,"All subjects are running on a treadmill for two hours in order to generate a slowly increasing dehydration. Measurements are collected every 15 minutes.<br/><br/>Ground truth of total body water is measured via the combination of D2O dilution (deuterium oxide) and monitoring of body weight.<br/><br/>Several noninvasive measurements are collected:<br/>- anthropometric measurements (e.g. age, height, length and perimeter of individual body parts)<br/>- bioimpedance<br/>- saliva: flow rate, protein concentration, osmolality<br/>- sweat: flow rate, concentration of chloride, sodium and potassium, osmolality<br/>- heart rate<br/>- blood pressure<br/>- core temperature<br/>- skin temperature<br/>- skin moisture<br/>- body volume <br/>- subjects' own perception of thirst and fatigue<br/><br/><br/>",NA,NA,NA,NA,Primary Sponsor,"Pattern Recognition Lab, Friedrich-Alexander-University Erlangen-Nuremberg",[---]*,[---]*,Contact for Scientific Queries,"Pattern Recognition Lab, Friedrich-Alexander-University Erlangen-Nuremberg",Matthias,Ring,10,"Recruiting complete, follow-up complete",yes,Monocenter trial,NA,NA,NA,NA,NA,NA,NA,NA,NA,NA,NA,NA,NA,NA,NA
77,84,DRKS00007844,HK,EN,Erlangen,Erlangen,,3,10.1007/s00103-018-2789-9 ,https://pubmed.ncbi.nlm.nih.gov/30046864/,yes,25.07.2018,no,,,MetropolMediplan 2016 - MMP16: <br/>Testing and further development of a medication plan in practice with respect to acceptance and practicability,2015-07-15,2015-06-29,Actual,2017-03-31,Arm 1,"Phase I (1st-8th month): In the first two weeks of the first trial phase the participating doctor's surgeries and pharmacies will be traines in using standard operating procedures for the following topics:<br/>- creating updating und archiving medication plans<br/>- inclusion of patients according to the study protocol.<br/>In the first trial phase the current specification and the update rules of the federal patient oriented medication plan will be evaluated.<br/>Phase II (9th-14th month): In the second trial phase the results of the first trial phase will be used to improve the specification and implementation of medication plans. The improved medication plan shall be evaluated.<br/>Phase III (15th-21th month): In the third trials phase the results of the evaluation of the second trial phase will be used to optimize the specification am implementation of medicatin plan. The optimized medication plan shall be evaluated. The resluts of all trial phases summarized in a final report.<br/>Stage 1  (all patients in all 3 study phases): Using of medication plans. All patients have the possibility to participate, if they agree using medication plans in their treatment. It shall be examined whether medication plans are suitable for the use in pharmacotherapy safety by examining anonymized data. The minimal aim is to include a minimum of 300 patients using medication plans.",Arm 2,"Stage 2 (Interview with 110 patients in all 3 study phases): In this stage an additional interview will be performed with extended data collection. These patients have to be informed separately before giving their informed consent. The interviews will be performed by participating doctor’s surgeries. Using a random sample (about 60) of these patients, a data verification will be performed comparing the medication plan data with the patient record and the documentation of pharmacies.",NA,NA,Primary Sponsor,Klinikum Fürth Zentrale Notaufnahme (ZNA),Harald,Dormann,Contact for Scientific Queries,Klinikum Fürth Zentrale Notaufnahme (ZNA),Harald,Dormann,1010,"Recruiting complete, follow-up complete",yes,Multicenter trial,NA,NA,NA,NA,NA,NA,NA,NA,NA,NA,NA,NA,NA,NA,NA
92,137,DRKS00008054,HK,EN,Freiburg,Freiburg,,1,10.1080/10410236.2018.1431760 ,https://pubmed.ncbi.nlm.nih.gov/29388797/,yes,01.02.2018,no,,,Development and evaluation of a communication skills training to improve social participation of persons with rheumatic diseases,2015-09-07,2015-11-16,Actual,2016-12-08,Arm 1,"Intervention group: participants attend the communication training between measurement points t0 and t1 of the survey<br/><br/>The training comprises two modules (approximately 2,5 h each). The modules are conducted on one or two dates.",Arm 2,wait-list control group: participants attend the communication training after the survey,NA,NA,Primary Sponsor,Universitätsklinikum Freiburg Sektion Versorgungsforschung und Rehabilitationsforschung,[---]*,[---]*,Contact for Scientific Queries,Universitätsklinikum Freiburg Sektion Versorgungsforschung und Rehabilitationsforschung,Erik,Farin-Glattacker,400,"Recruiting complete, follow-up complete",yes,Monocenter trial,Paper,[---]*,"Schöpf, A.C., Schlöffel, M., Amos, T., Thyrolf, A., Lamprecht, J., Mau, W., Böhm, P. & Farin, E. (in press). Development and formative evaluation of a communication skills training program for persons with rheumatic and musculoskeletal diseases. Health Communication.https://doi.org/10.1080/10410236.2018.1431760",NA,NA,NA,NA,NA,NA,NA,NA,NA,NA,NA,NA
64,15,DRKS00011936,HK,TB,Bochum,Bochum,,2,10.1007/s10396-010-0263-x,https://pubmed.ncbi.nlm.nih.gov/27278011/,yes,23.04.2010,no,,Title misspelled in DRKS,Ultrasound based diagnostic of juvenile forearme fractures,2017-04-24,2012-11-01,Actual,2014-11-20,Arm 1,"Patients with or withoud fracture (radius or ulna or combined)<br/><br/>After taking the history and informed consent a ultrasound examination from 6 standard position sis performed. If the results reveal the indication for operative treatment, an x-ray is taken and the patient drops out the study. If there is an indication for reduction but not osteosynthesis, the patient remains in the study if the stability allows ultrasound examination without a cast, otherwise the patient drops out.<br/>For all patients remaining in the study the clinical variables are noted.<br/><br/>- if the US imaging reveals a fracture, a cast is applied<br/>- if the US revelas no fracture and at least one variable is positive, a suspect of a fracture is diagnosed and a cast applied<br/>- if the US reveals no fracture and no varaible is positive, a functional treatment is indicated<br/><br/>All patients are re-evaluated after 5 days and the clinical variables are noted. For all patients without a proved fractures diagnosis and no positive variables a functional treatment is indicated at this time. If there is at least one positive clinical variable, x-rays in 2 directions are taken and the result is noted.<br/><br/>All patients are reevaluated after 3 months by phone contact or physical examination.",NA,NA,NA,NA,Primary Sponsor,Ruhr Universutät Bochum,Ole,Ackermann,Contact for Scientific Queries,Ruhr Universutät Bochum,Ole,Ackermann,498,"Recruiting complete, follow-up complete",yes,Multicenter trial,NA,NA,NA,NA,NA,NA,NA,NA,NA,NA,NA,NA,NA,NA,NA
71,63,DRKS00011525,HK,TB,Duisburg,Duisburg,,8,,https://www.drks.de/drks_web/AttachmentDownstreamServlet?ID=12ef0087-0e2e-4c11-a392-a855c1f586ed&LOCALE=en&FILENAME=Abstract%20SIO%202016%20PNP.pdf,no,05.11.2016,no,,conf abstract; interim results only,"Manual body acupuncture and self-administered hydrotherapy in the treatment of chronic, chemotherapy-induced peripheral neuropathy <br/><br/>- a randomized controlled trial",2017-01-02,2013-03-27,Actual,2015-12-14,Arm 1,12 manual acupuncture session (2x/week for 6 weeks) following a semi-standardized protocol,Arm 2,self-administered cold water appplications on legs or arms as required (for six weeks),NA,NA,Primary Sponsor,"Universität Duisburg-Essen<br/>Lehrstuhl und Klinik für Naturheilkund und Integrative Medizin, <br/>Knappschafts-Krankenhaus,<br/>Kliniken Essen-Mitte",Gustav,Dobos,Contact for Scientific Queries,"Universität Duisburg-Essen,<br/>Lehrstuhl und Klinik für Naturheilkunde und Integrative Medizin,<br/>Knappschafts-Krankenhaus,<br/>Kliniken Essen-Mitte",Gustav,Dobos,50,"Recruiting complete, follow-up complete",yes,Monocenter trial,Abstract,Abstract SIO 2016 PNP.pdf,Society for Integrative Oncology Abstract 2016,NA,NA,NA,NA,NA,NA,NA,NA,NA,NA,NA,NA
87,122,DRKS00005943,HK,TB,Freiburg,Freiburg,,1,,https://hds.hebis.de/ubgi/Record/HEB425132986,no,05.10.2017,no,,dissertation,The role of different brain regions in motor learning.,2014-04-02,2014-05-12,Actual,2014-07-21,Arm 1,"Group PFC: transcranial direct current stimulation of prefrontal cortex (PFC). Duration: 20 min, Instensity: 80 µA/cm^2",Arm 2,"Group cerebellum: transcranial direct current stimulation of crebellum. Duration: 20 min, Instensity: 80 µA/cm^2",Arm 3,Group Sham PFC: Placebo stimulation of prefrontal cortex. Stimulation only in the initial and final part of the 20 minutes. Intensity: 80 µA/cm^2,Primary Sponsor,"Albert-Ludwigs-Universität Freiburg, Institut für Sport und Sportwissenschaft<br/>",Albert,Gollhofer,Contact for Scientific Queries,"Albert-Ludwigs-Universität Freiburg, Institut für Sport und Sportwissenschaft<br/>",Albert,Gollhofer,60,"Recruiting complete, follow-up complete",yes,Monocenter trial,Paper,https://hds.hebis.de/ubgi/Record/HEB425132986,"Dissertation R. Schween: Influences of Feedback and Transcranial Direct Current Stimulation on Explicit and Implicit Processes of Learning Visuomotor Rotations. Justus-Liebig-Universitaet Giessen, 2017. Dort insb. Kapitel 5.",NA,NA,NA,NA,NA,NA,NA,NA,NA,NA,NA,NA
99,156,DRKS00012439,HK,TB,Freiburg,Freiburg,,3,10.1080/10715762.2018.1440293,https://www.tandfonline.com/doi/abs/10.1080/10715762.2018.1440293?journalCode=ifra20,yes,15.03.2018,no,,,Acute Effects of Blood Flow Restriction on Exercise-Induced Free Radical Production in Young and Healthy Subjecty: A Randomized Controlled Trial,2017-07-24,2017-01-09,Actual,2017-09-29,Arm 1,low-intensity exercise with blood flow restriction (LIBR); intensity: 30% 1RM; repetitions: 30-15-15-15; interset rest period: 30 sec,Arm 2,low-intensity exercise without blood flow restriction (LI); intensity: 30% 1RM; repetitions: 30-15-15-15; interset rest period: 30 sec,Arm 3,high-intensity exercise without blood flow restriction (HI); intensity: 80% 1RM; repetitions: 10-10-10; interset rest period: 2 min,Primary Sponsor,"Institut für Sport und Sportwissenschaft, Albert-Ludwigs-Universität Freiburg",Daniel,König,Contact for Scientific Queries,Albert-Ludwigs-Universität Freiburg,Christoph,Centner,15,"Recruiting complete, follow-up complete",yes,Monocenter trial,NA,NA,NA,NA,NA,NA,NA,NA,NA,NA,NA,NA,NA,NA,NA
100,160,DRKS00005421,HK,TB,Giessen,Giessen,,8,,https://link.springer.com/content/pdf/10.1007/s00112-014-3204-8.pdf ,no,,no,,conf abstract; interim results only,Observational study of the daily intake of 1000 IU Vitamin D3 during pregnancy on the 25-hydroxyvitamin D status,2013-11-08,2013-02-01,Actual,2014-11-18,Arm 1,"Oral supplementation with 1000 IU vitamin D3 per day (Vigantoletten, Merck) after diagnosed vitamin D deficiency, defined as Serum 25 OH D ≤ 50 nmol/l (≤ 20 ng/mL). Supplementation starts between the 12th and 16th week of gestation until delivery.",Arm 2,"No diagnosis of vitamin D deficiency  and no vitamin D supplementation, Serum 25 OH D level > 50 nmol/l (> 20 ng/mL).",NA,NA,Primary Sponsor,"Institut für Ernährungswissenschaft, JLU Giessen",Clemens,Kunz,Contact for Scientific Queries,"Institut für Ernährungswissenschaft, JLU Giessen",Clemens,Kunz,100,"Recruiting complete, follow-up complete",yes,Monocenter trial,NA,NA,NA,NA,NA,NA,NA,NA,NA,NA,NA,NA,NA,NA,NA
3,315,DRKS00000162,SW,TB,Leipzig,Leipzig,,2,,https://www.clinicaltrialsregister.eu/ctr-search/trial/2008-003064-19/results ,no,02.08.2020,no,,EudraCT results,"Phase-IIb-Study to Evaluate the Effect of a Neoadjuvant Chemotherapy with Docetaxel, Epirubicine and Cyclphosphamide (TEC) in Patients with primary HER-2 neu Negative Mammacarcinoma",2009-07-20,2009-03-23,Actual,2016-07-07,Arm 1,neoadjuvant chemotherapy<br/>6 cycles a:<br/>Docetaxel: 75 mg/m square<br/>Epirubicine: 75 mg/m square<br/>Cyclophosphamide 500 mg/m square<br/><br/>and breast surgery,NA,NA,NA,NA,Primary Sponsor,Universität Leipzig,Susanne,Briest,Contact for Scientific Queries,Koordinierungszentrum für Klinische Studien Leipzig,Anja,Broda,150,"Recruiting complete, follow-up complete",yes,Multicenter trial,Paper,[---]*,"Senologie - Zeitschrift für Mammadiagnostik und -therapie 2012; 9 - A98. Erste Ergebnisse der Phase-IIb-Studie zur Erfassung der Effektivität einer neoadjuvanten Chemotherapie mit Docetaxel, Epirubicin und Cyclophosphamid (TEC) bei Patientinnen mit primärem HER-2 neu negativem Mammakarzinom (NeoTEC-Studie), D Langanke 1, U Wolfeneck 1, A Franke",NA,NA,NA,NA,NA,NA,NA,NA,NA,NA,NA,NA
