79;90;DRKS00013047;Erlangen;2;Erlangen;10.1186/s12871-017-0435-y ;https://pubmed.ncbi.nlm.nih.gov/29041920/;yes;17.10.2017;no;;;Intraoperative neuromonitoring of neurosurgical patients using a non-invasive tissue-photospectrometry technique ;2017-10-02;2013/10/04;Actual;2017/10/21;Arm 1;A non-invasive combined Laser-Doppler-flowmeter and tissue-spectrophotometer is used in patients undergoing scheduled intracranial surgery (group 1) to record local cerebral microcirculation intraoperatively. At the same time, somatosensory evoked potentials (SEP) as an established neuromonitoring technique were measured.;Arm 2;A non-invasive combined Laser-Doppler-flowmeter and tissue-spectrophotometer is used in patients which underwent neurosurgery in an emergency setting within 72 hours (group 2). Pathological changes of local cerebral microcirculation during intraoperative measurements are compared to changes of somatosensory evoked potentials (SEP), which are recorded at the same time.;;;Primary Sponsor;Neurochirurgische Klinik, Universitätsklinikum Erlangen;Michael;Buchfelder;Contact for Scientific Queries;Paracelsus-Klinik Osnabrück, Neurochirurgische Abteilung;Björn;Sommer;100;Recruiting complete, follow-up complete;yes;Monocenter trial;trial protocol (mandatory for transfer to Studybox);O2C_Studienprotokoll.pdf;Studienprotokoll Intraoperatives vaskuläres Neuromonitoring;;;;;;;;;;;;
91;131;DRKS00006303;Freiburg;0;;;;;;;;;Osypka BabyStent® for the treatment of aortic isthmus stenosis in early childhood;2014-12-19;2015/09/10;Actual;2017/10/10;Arm 1;Implantation of Osypka BabyStent(R);;;;;Primary Sponsor;Universitäts Herzzentrum Freiburg Bad KrozingenKlinik für Angeborene Herzfehler und Pädiatrische Kardiologie;Brigitte;Stiller;Contact for Scientific Queries;Universitäts Herzzentrum Freiburg Bad KrozingenKlinik für Angeborene Herzfehler und Pädiatrische Kardiologie;Brigitte;Stiller;19;Recruiting complete, follow-up complete;yes;Multicenter trial;;;;;;;;;;;;;;;
278;6;DRKS00012871;Aachen;3;yes;10.1186/s12938-018-0526-0;https://link.springer.com/article/10.1186/s12938-018-0526-0 ;yes;13.07.2018;no;;;Application of EIT to determine bladder volume;2017-08-24;2013/09/02;Actual;2014/12/31;Arm 1;Interventional, open proband study of the measurement of the electrical impedance at filled and emptied bladder with measuring times of 5 minutes per cycle each with different electrode arrangements.;;;;;Primary Sponsor;Klinik für UrologieUniklinik RWTH Aachen;Joachim;Grosse;Contact for Scientific Queries;Klinik für UrologieUniklinik RWTH Aachen;Joachim;Grosse;12;Recruiting complete, follow-up complete;yes;Monocenter trial;Approval of ethics comm. (mandatory for transfer to Studybox);13-042_2013-07-25_Votum BlasenEIT.pdf;Ethics Votum;Further trial documents;13-042_BlasenEIT_CRF_Version 01_07-08-2013.pdf;Patient survey;Further trial documents;EIT_Messprotokoll_UKA_HIA .pdf;Messprotokoll Elektrische Impedanztomographie;;;;;;
388;2;DRKS00004887;Aachen;3;yes;;http://www.refonet.de/cms/upload/pdf/PKT_Abschlussbericht_final.pdf ;no;01.01.2017;no;;"Published 2017 (no precise date); Subsequent journal publication: https://pubmed.ncbi.nlm.nih.gov/31108553/ ";Changing lifestyle and improving subjective judgment of occupation by a  planning-competence-training with follow-up care among type II diabetes mellitus and adiposity inpatients: a randomized controlled trail. ;2013-10-07;2013/01/16;Actual;2015/04/30;Arm 1;Experimental condition: Planning-Competence training with follow-up care.<br/><br/>The planning competence training is composed of four training units (length 1 -1,5 h) and a transfer session.<br/>Following three training units the transfer session is placed before the last training unit, which is a parallel construct to the first unit thus functioning as a performance control. <br/>By providing an opportunity for reflection of the training contents the transfer session supports the process of implementing the content to daily life (length 1,5 h).  The units take place at five sequenced days. The individual target planning<br/>During an one-on-one closing interview(length: about one hour) at the end of the rehabilitation process at the clinic certain goals and plans are defined individually.  Each patient formulates individual self-instructions helping to put the plans concnering lifestyle shift into practice. The telephone follow-up care lasts six months in which the patient is called every four weeks. Throughout those phone calls the planned goals and lifestyle shifts are discussed (length about 15 minutes). <br/>;Arm 2;Control group 1: Planning-Competence training without follow-up care;Arm 3;Control group 2:  Placebocondition with placebo follow-up care<br/>The placebo- intervention serves lectures about general topics in health care and prevention like stressprevention, relaxation, alcohol, burnout prevention and salutogenisis (length about 30 minutes). In addition the contact is abided by  one-on-one interviews in the end of the training and a placebo telephone follow-up care (each telephone call lasting about 15 minutes).  General state of health is addressed during those calls without bringing up the topics of lifestyle shift.<br/><br/><br/>;Primary Sponsor;REFONET;Burkhard;Wild;Contact for Scientific Queries;Institut für Psychologie<br/>RWTH Aachen, Lehr- & Forschungsgebiet Berufliche Rehabilitation;Viktoria;Arling;791;Recruiting complete, follow-up complete;yes;Monocenter trial;;;;;;;;;;;;;;;
401;;DRKS00005035;Hamburg;3;Hamburg;10.1016/j.addbeh.2018.05.002;;yes;04.05.2018;yes;several publications with the id, but those are secondary analyses. This publication refers to the exact title of the registration but with an ID from a different registry, so the trial might be registered in multiple registers;;Allocation of patients with alcohol use disorders to appropriate levels of care according to a decision algorithm based on a standardized intake assessment;2013-06-03;2013/06/09;Actual;2014/12/23;Arm 1;"The patients get an 75-minute interview, which gives treatment recommendations (MATE, Schippers et al., 2011). This interview will take place one week after admission, when somatic detoxification has been done. To evaluate health care costs, the Client Sociodemographic and Service Receipt Inventory (CSSRI; Chisholm et al., 2000) will be applied. For evaluating psychological aspects the rehabilitee management categories will be given to the patient as questionnaire (RMK; Spyra et al., 2011). The EQ-5D will be applied to asses quality of life (Prieto et al., 2003). Patients of the intervention group and the clinical staff will receive a feedback session about the results and the MATE-LOC recommendations. A feedback session will take place with the interviewer and the patient where the results and the recommendationwill be explained to the patient. Interviewer and patient will discuss the results and both will agree on one treatment for the patient together.";Arm 2;"After completing a 75 minute interview (MATE; CSSRI; Chisholm et al., 2000; EQ-5D; Prieto et al., 2003) and a questionnaire (RMK; Sprya et al., 2011), patients of the control group and the clinical staff will receive a written evaluation of the general results of the MATE interview, if patients want to know, but without a standardized treatment recommendation. A treatment recommendation will be given to the patients as the therapists usually do. ";;;Primary Sponsor;Universitätsklinikum Hamburg-Eppendorf <br/>Insitut und Poliklinik für Medizinische Psychologie;Angela;Buchholz;Contact for Scientific Queries;Universitätsklinikum Hamburg-Eppendorf<br/>Institut und Poliklinik für Medizinische Psychologie;Angela;Buchholz;286;Recruiting complete, follow-up complete;yes;Multicenter trial;;;;;;;;;;;;;;;
421;;DRKS00000741;Jena;3;Jena;10.1001/jama.2016.7207;;yes;28.06.2016;no;;;Sepsis survivors Monitoring and coordination in Outpatient Health care;2011-03-02;2011/02/28;Actual;2015/12/31;Arm 1;control group: usual care;Arm 2;Patients of the intervention group will receive for 12 month in total a specific Disease Management Program, consisting of discharge management, patient monitoring for main sepsis complications and education of patients and treating family physicians in sepsis sequelae ;;;Primary Sponsor;Institut für Allgemeinmedizin der Friedrich Schiller Universität Jena;Jochen;Gensichen;Contact for Scientific Queries;Institut für Allgemeinmedizin<br/>Universitätsklinikum Jena, Friedrich-Schiller-Universität;Konrad;Schmidt;290;Recruiting complete, follow-up complete;yes;Multicenter trial;;;;;;;;;;;;;;;
419;;DRKS00007781;Homburg;2;Homburg;10.1159/000502008;;yes;27.08.2019;;;;Effect of dietary lipid modification on nonalcoholic fatty liver disease in carriers of the PNPLA3 I148M genetic variant: an open label trial;2015-03-25;2015/03/27;Actual;2016/12/20;Arm 1;After following a two week run-in phase, subjects will be given omega 3 supplements (4g p.o. contained in 1 tablet daily) for 4 weeks.;;;;;Primary Sponsor;Saarland University Medical Center;Frank;Lammert;Contact for Scientific Queries;Saarland University Medical Center;Caroline;Stokes;20;Recruiting complete, follow-up complete;yes;Monocenter trial;;;;;;;;;;;;;;;
