number_new;number;ID;cities_lead;Publication identified in which step;manual_validation_cities_lead;publication_DOI;publication_URL;article_yes_no;publication_date;unsure_about_publ_yes_no;reason;other_comments;title;firstDrksPublishDate;startDate;startDate_plannedActual;studyEnd;intervention.category0;intervention.value0;intervention.category1;intervention.value1;intervention.category2;intervention.value2;address.type0;address.affiliation0;address.firstname0;address.lastname0;address.type1;address.affiliation1;address.firstname1;address.lastname1;targetSize;recruitmentStatus;investorInitiated;monoMultiCentric;publication.category0;publication.type0;publication.value0;publication.category1;publication.type1;publication.value1;publication.category2;publication.type2;publication.value2;publication.category3;publication.type3;publication.value3;publication.category4;publication.type4;publication.value4
22;378;DRKS00004944;Munich;0;Munich LMU;;;;;;;;ALS-rules;2013-05-02;2013/11/08;Actual;2014/03/31;Arm 1;Group without intervention – conventional training for medical students with a cardiac arrest scenario in an OSCE  (Objective Structured Clinical Examinations);Arm 2;Group with intervention (ALS-rules) - conventional training for medical students with additional concise abstract using keywords in the educational script and finally a cardiac arrest scenario in an OSCE;Arm 3;Group with intervention (ALS-rules) - conventional training for medical students with additional charts in the educational script and finally a cardiac arrest scenario in an OSCE;Primary Sponsor;Institut für Notfallmedizin und Medizinmanagement (INM), Klinikum der universität München;[---]*;[---]*;Contact for Scientific Queries;Klinikum der Universität München<br/>Institut für Notfallmedizin und Medizinmanagement<br/>Bereich Medizin;Oliver;Meyer;231;Recruiting complete, follow-up complete;yes;Monocenter trial;Paper;[---]*;[---]*;;;;;;;;;;;;
376;384;DRKS00006093;Munich;2;Munich LMU;;;other;19.05.2020;;;"Dissertation: ""Einfluss von direktem Manikin-Feedback versus indirektem Instruktor-Feedback auf die Performanzder Thoraxkompressionen durch Medizinstudierende""";Direct vs indirect Feedback during CPR Training;2014-04-28;2014/05/02;Actual;2014/07/25;Arm 1;Group with direct feedback – students see the manikin screen in real time;Arm 2;Group with indirect feedback – only the audience sees the manikin screen but give feedback on to the student in real time;;;Primary Sponsor;Institut für Notfallmedizin und Medizinmanagement (INM), Klinikum der universität München;[---]*;[---]*;Contact for Scientific Queries;Institut für Notfallmedizin und Medizinmanagement (INM), Klinikum der Universität München;Oliver;Meyer;240;Recruiting complete, follow-up complete;yes;Monocenter trial;Paper;[---]*;[---]*;;;;;;;;;;;;
378;386;DRKS00006211;Munich;9;none;;;;;;;;Impact of diet-induced obesity on gut barrier integrity and metabolic diseases in healthy subjects;2014-06-11;2013/04/30;Actual;2014/08/15;Arm 1;24 healthy male subjects (BMI less or equal 25 kg/m²) receive an individually adapted diet for seven days with an excess of 1000kcal/day in addition to their individual total energy requirement. The macronutrient composition consists of 48 EN% fat (predominantly saturated fatty acids), 34 EN% carbohydrates and 18 EN% protein. Gut permeability, changes in gut microbiota, insulin sensitivity, peripheral immune cell sub-populations, blood pressure, pulse, metabolic rate, body composition, weight, blood parameters (fasting glucose, fasting insulin, liver function, kidney function, electrolyte, lipid profile, DNA, inflammation marker) will be measured before, after and 2 weeks after intervention.;;;;;Primary Sponsor;Bundesministerium für Bildung und Forschung Dienstsitz Berlin;[---]*;[---]*;Contact for Scientific Queries;Else Kröner-Fresenius-Zentrum für ErnährungsmedizinLehrstuhl für ErnährungsmedizinTechnische Universität München;Hans;Hauner;24;Recruiting complete, follow-up complete;yes;Monocenter trial;;;;;;;;;;;;;;;
379;392;DRKS00009733;Munich;0;Munich LMU;;;;;;;;Effects of Acetyl-DL-Leucine on cerebellar ataxia - a multinational, multicenter, randomized, double-blind, placebo-controlled, 2-way crossover phase III trial;2016-01-15;2016/01/25;Actual;2017/07/07;Arm 1;Treatment with Acetyl-DL-Leucine (5 g daily) over a period of 4 weeks after a titration of dosage over a period of 2 weeks, complete duration of treatment 6 weeks. <br/>;Arm 2;Treatment with placebo over a period of 6 weeks;;;Primary Sponsor;Klinikum der Universität München, Campus Großhadern;[---]*;[---]*;Contact for Scientific Queries;Deutsches Zentrum für Schwindel- und Gleichgewichtsstörungen und Neurologische Klinik und Poliklinik, Campus Großhadern;Katharina;Feil;108;Recruiting complete, follow-up complete;yes;Multicenter trial;;;;;;;;;;;;;;;
386;414;DRKS00013485;Rostock;2;Rostock;10.1111/1751-2980.12591;https://onlinelibrary.wiley.com/doi/10.1111/1751-2980.12591;yes;23.03.2018;yes;only 7 out of 17 patients reported. Outcomes are repored, so would count this pub.;;Influence of vitamin D administration on the intestinal bacterial composition in CD patients and healthy controls;2017-12-04;2016/11/15;Actual;2017/05/05;Arm 1;Crohn's disease:<br/>The intervention was carried out by means of decristol 20,000 IU, every two days up to a target level between 100 and 150 nmol/l. At higher values, vitamin D substitution was suspended. The duration of the substitution was 4 weeks. ;Arm 2;Healthy Controls:<br/>The intervention was carried out by means of decristol 20,000 IU, every two days up to a target level between 100 and 150 nmol/l. At higher values, vitamin D substitution was suspended. <br/>The duration of the substitution was 4 weeks. ;;;Primary Sponsor;Universitätsklinikum Rostock;Holger;Schäffler;Contact for Scientific Queries;Universitätsklinikum Rostock;Holger;Schäffler;17;Recruiting complete, follow-up complete;yes;Monocenter trial;;;;;;;;;;;;;;;
149;442;DRKS00003979;Ulm;1;Ulm;10.13109/prkk.2015.64.3.172;https://www.vr-elibrary.de/doi/10.13109/prkk.2015.64.3.172;yes;01.04.2015;yes;"There is a German (2015) and an English (2017) publication. I have entered the earlier ones, even though I could not view the full text here and the abstract does not provide much information. The English publication meets our criteria, so it would be a pub in any case (but 2 years later). 
10.1016/j.chiabu.2017.03.008
https://www.sciencedirect.com/science/article/abs/pii/S014521341730100X
31.03.2017";;Implementation and Evaluation of a Needs- and Community-Based Managed Mental Healthcare for Children and Adolescents after Abuse and Neglect - Case-Management Intervention Study;2012-07-03;2012/10/29;Actual;2017/05/04;Arm 1;Case-Management: Allocation to a Case-Manager who is trained in acting as a broker and placing the underage CAN-child in appropriate therapy programs, to accompany the therapy process, to assist the child and its family in terms of upcoming adherence difficulties and to monitor therapy outcome.;Arm 2;Usual Care ;;;Primary Sponsor;Universitätsklinikum Ulm<br/>Klinik für Kinder- und Jugendpsychiatrie/Psychotherapie<br/><br/><br/>;Lutz;Goldbeck;Contact for Scientific Queries;Universitätsklinikum Ulm Klinik für Kinder- und Jugendpsychiatrie/Psychotherapie;Lutz;Goldbeck;152;Recruiting complete, follow-up complete;yes;Multicenter trial;Paper;http://www.sciencedirect.com/science/article/pii/S014521341730100X;Publikation im Journal of Child Abuse and Neglect: Effectiveness of manualized case management on utilization of evidence-based treatments for children and adolescents after maltreatment: A randomized controlled trial  von Helene Gertrud Ganser, Annika Münzer, Andreas Witt, Paul Lukas Plener, Rainer Muche, Rita Rosner, Maria Hagl, Lutz Goldbeck;Paper;https://www.ncbi.nlm.nih.gov/pubmed/25832576;Publikation in der Fachzeitschrift Praxis der Kinderpsychologie und Kinderpsychiatrie: Verbesserter Zugang zu evidenzbasierten Therapien für psychisch kranke Kinder und Jugendliche nach Kindesmisshandlung und -missbrauch von Helene G. Ganser, Annika Münzer, Diana C. M. Seitz, Andreas Witt und Lutz Goldbeck;;;;;;;;;
151;452;DRKS00012927;Ulm;1;Ulm;;https://pubmed.ncbi.nlm.nih.gov/29967902/;yes;01.01.2018;no;;;Template-guided implantation of one-piece ceramic implants.<br/>A prospective clinical pilot study.<br/>;2017-09-07;2017/09/18;Actual;2017/12/18;Arm 1;Template-guided implantation of one-piece full-ceramic implants with a new, sleeveless drilling template.<br/>;;;;;Primary Sponsor;Universitätsklinikum Ulm/Studienleiter: Prof. Dr. Ralph G. Luthardt, Klinik für Zahnärztliche Prothetik;[---]*;[---]*;Contact for Scientific Queries;Private Praxis und Universitätsklinikum Ulm, Klinik für Zahnärztliche Prothetik;Sigmar;Schnutenhaus;12;Recruiting complete, follow-up complete;yes;Monocenter trial;Paper;[---]*;Precision of sleevless 3D drill guides for insertion of one-piece ceramic implants: a prospective clinical trial. S. Schnutenhaus, V. von Koenigsmarck, S. Blender, L. Ambrosius, R.G. Luthardt, H. Rudplph (2018), International Journal of Computerized Dentistry: 97-105;;;;;;;;;;;;
252;305;DRKS00010061;Köln;2;Köln;https://doi.org/10.1159/000480356 ;https://iovs.arvojournals.org/article.aspx?articleid=2637008;yes;27.09.2017;no;;;Prospective, early, intensified controll of central retinal thickness by optical coherence tomography to detect early recurrence of disease after treatment of neovascular Age-related macula degeneration (nAMD) by intravitreal injection ;2016-04-04;2016/04/01;Actual;2016/09/15;Arm 1;Intervention group : All patients received three additional OCT examinations (optical coherence tomography) by protocol - in Detail: an examination of both eyes on day 7 (+/- 2 days) , day 14 (+/- 2) and day 21 (+/- 2) after injection of treatment;;;;;Primary Sponsor;Zentrum für AugenheilkundeUniklinik Köln;Sascha;Fauser;Contact for Scientific Queries;Zentrum für Augenheilkunde der Uniklinik Köln;Sascha;Fauser;100;Recruiting complete, follow-up complete;yes;Monocenter trial;;;;;;;;;;;;;;;
433;286;DRKS00004450;Köln;9;Köln (DSHS);;;;;;;study conducted at Deutsche Sporthochschule Köln - UMC not involved;"Effects of a targeted, individualized sports therapy program for childhood cancer patients on motor Performance<br/><br/>Publication: Beulertz J, Prokop A, Rustler V, Bloch W, Felsch M, Baumann FT. Effects of a 6-Month, Group-Based, Therapeutic Exercise Program for Childhood Cancer Outpatients on Motor Performance, Level of Activity, and Quality of Life. Pediatric Blood and Cancer. 2016;63(1):127-132. ";2012-10-09;2012/07/18;Actual;2015/03/31;Arm 1;6-month sports therapy program for childhood cancer patients after inpatient medical treatment (once a week, 60 minutes);Arm 2;"childhood cancer patients; no intervention";Arm 3;"healthy children; no intervention";Primary Sponsor;Deutsche Sporthochschule Köln, Institut für Kreislaufforschung und Sportmedizin, Abteilung Molekulare und Zelluläre Sportmedizin;Freerk;Baumann;Contact for Scientific Queries;Deutsche Sporthochschule Köln, Institut für Kreislaufforschung und Sportmedizin, Abteilung Molekulare und Zelluläre Sportmedizin;Freerk;Baumann;69;Recruiting complete, follow-up complete;yes;Monocenter trial;Paper;[---]*;"Beulertz J, Prokop A, Rustler V, Bloch W, Felsch M, Baumann FT. Effects of a 6-Month, Group-Based, Therapeutic Exercise Program for Childhood Cancer Outpatients on Motor Performance, Level of Activity, and Quality of Life. Pediatric Blood and Cancer. 2016;63(1):127-132. ";;;;;;;;;;;;
434;287;DRKS00004735;Köln;3;Köln (DSHS);https://doi.org/10.1188/17.CJON.E280-E286;https://cjon.ons.org/cjon/21/6/computer-based-exercise-program-effects-12-week-intervention-mood-and-fatigue-pediatric;yes;01.12.2017;no;;article paywalled and does not report registry number, but the rest seems to fit;Integrability of a computer-based exercise program in the Pediatric Oncology and effects on fatigue syndrome and quality of life in pediatric oncology patients.<br/>PAPO - „Physical Activity in the Pediatric Oncology“;2013-02-13;2013/07/15;Actual;2015/02/28;Arm 1;Computer-based exercise program for pediatric oncology patients while stationary and outpatient hospital stay during three month. Exercise program takes place once a week, duration and intensity is determined depending on day form. Guidance for the intervention duration is 30 minutes. ;;;;;Primary Sponsor;Deutsche Sporthochschule Köln, Institut für Bewegungs- und Neurowissenschaft;[---]*;[---]*;Contact for Scientific Queries;Deutsche Sporthochschule Köln, Institut für Bewegungs- und Neurowissenschaft;Anna-Maria;Platschek;12;Recruiting complete, follow-up complete;yes;Monocenter trial;Paper;[---]*;[---]*;;;;;;;;;;;;
441;300;DRKS00008578;Köln;3;Köln (DSHS);https://doi.org/10.1097/PEP.0000000000000536;https://journals.lww.com/pedpt/Fulltext/2018/10000/Whole_Body_Vibration_Training_Designed_to_Improve.15.aspx;yes;30.10.2018;no;;article does not report registry number, but the rest seems to fit;Feasibility and effects of Whole-body vibration training in pediatric cancer patients undergoing chemotherapy;2015-06-03;2015/09/11;Actual;2017/12/01;Arm 1;Intervention group includes pediatric cancer patients (4-17 years) under chemotherapy that receive standard care and Whole-body vibration training. Standard care includes the daily offer of physiotherapy and the offer of sports therapy twice a week. Whole-body vibration training is applied 2-3x/week for 9-14 minutes (Vibration Frequency 18-30 Hz, amplitude 2 mm).;;;;;Primary Sponsor;Deutsche Sporthochschule Köln, Insstitut für Kreislaufforschung und Sportmedizin, Abteilung molekulare und zelluläreSportmedizin;Freerk;Baumann;Contact for Scientific Queries;Deutsche Sporthochschule Köln, Institut für Kreislaufforschung und Sportmedizin, Abteilung molekulare und zelluläre Sportmedizin;Freerk T.;Baumann;15;Recruiting complete, follow-up complete;yes;Monocenter trial;;;;;;;;;;;;;;;
6;325;DRKS00006178;Leipzig;0;Leipzig;;;;;;;;Wound Management in Post-Bariatric Surgery<br/>Investigation for the reduction of the mean drainage volume in patients after abdominoplasty / lower body lift using Artiss Fibrin Sealant in comparison to the standard procedure;2014-05-20;2014/08/08;Actual;2017/03/03;Arm 1;abdominoplasty / lower body lift using Artiss Fibrin Sealant;Arm 2;Standard abdominoplasty / lower body lift ;;;Primary Sponsor;Universität Leipzig;[---]*;[---]*;Contact for Scientific Queries;Universitätsklinikum Leipzig AöRDepartment für operative Medizin (DOPM)Abteilung für Plastische, Ästhetische und spezielle Handchirurgie;Stefan;Langer;50;Recruiting stopped after recruiting started ;yes;Monocenter trial;;;;;;;;;;;;;;;
113;337;DRKS00003527;Magdeburg;9;Magdeburg;;;;;;;final report provided in the registry - also, there seem to be a couple of related studies out there, but none report the primary outcome;Ketamine in treatment resistant major depression (TRD) -<br/>A placebo controlled, double blind, randomized trial of efficacy, safety and response prediction by resting state fMRI<br/>;2012-03-07;2012/09/10;Actual;2016/04/22;Arm 1;Patients in the verum group will receive a single intravenous ketamine hydrochloride injection (0.5mg/kg body weight, 50 ml over 40 minutes). <br/>diagnostic intervention: Resting state fMRI and MRS before and after administration will be assessed on a 7T MR scanner.;Arm 2;healthy control subjects in the verum group will receive a single intravenous ketamine hydrochloride injection (0.5mg/kg body weight, 50 ml over 40 minutes). <br/>diagnostic intervention: Resting state fMRI and MRS before and after administration will be assessed on a 7T MR scanner.;Arm 3;Control treatment: patients allocated to the control group will receive placebo injections of 0.9 % saline (50 ml over 40 minutes) in the same fashion as the verum group;Primary Sponsor;Otto-von-Guericke University Magdeburg<br/>Medical Faculty;Hermann-Josef;Rothkötter;Contact for Scientific Queries;Clinic for Psychiatry and Psychotherapy<br/>Central Hospital Magdeburg;Martin;Walter;120;Recruiting complete, follow-up complete;yes;Monocenter trial;Trial results;KETREST_Zusammenfassung_Abschlussbericht_20180226_final.pdf;Ketrest_Abschlussbericht_clinical trial report;;;;;;;;;;;;
258;339;DRKS00005683;Magdeburg;2;Magdeburg;https://doi.org/10.1016/j.ebiom.2020.102712;https://www.sciencedirect.com/science/article/pii/S2352396420300876;yes;15.04.2020;no;;final report provided in the registry, which does not report results;"""Smart insole for patients with diabetic neuropathy for the prevention of foot ulcers""";2014-01-27;2014/02/03;Actual;2016/05/26;Arm 1;30 patients with sensorimotor neuropathy:<br/>Alternating between standing (pressure load for 5, 10 and 20 min) and in between a relief when sitting (5 min each), duplication;Arm 2;30 healthy subjects without sensory-motor neuropathy:<br/>Alternating between standing (pressure load for 5, 10 and 20 min) and in between a relief when sitting (5 min each), duplication;;;Primary Sponsor;Otto-von-Guericke Universität, Medizinsiche Fakultät;Hermann-Josef;Rothkötter;Contact for Scientific Queries;Universitätsklinik für Nieren- und Hochdruckkrankheiten, Diabetologie und Endokrinologie;Peter R.;Mertens;60;Recruiting complete, follow-up complete;yes;Monocenter trial;Trial results;Abschlussbericht_final_120617_komneu.pdf;Abschlussbericht;;;;;;;;;;;;
398;194;DRKS00010157;Halle;0;Halle;;;;;;;;Implementation of a short screening (UKS) for psychosocial problems for need-based referall to rehabilitation for patients with musculoskeletal diseases and psychosocial stress in primary care;2016-05-30;2016/06/06;Actual;2017/06/30;Arm 1;The consenting practices will be referred to the intervention group (IG) or control group (KG) through a randomized procedure and receive a study folder for documentation and provision of necessary study materials. After information and consent to participate, potential study participants receive a study folder with the same study materials (study information, declaration of consent, screening T0 (UKS)).<br/><br/>In the KG the screening sheet in original form is sent back only to scientists. In this group the choice of rehabilitation concept and clinic by the DRV reviewers is based on the usual criteria and documents. <br/><br/>Additionally, after receiving  an answer concerning their rehabilitation application through the DRV, participants of both groups fill out a T1-questionnaire and send it to the scientists.<br/>;Arm 2;In the IG the screening sheet (UKS) as well as an evaluation survey are added to the medical record in the rehabilitation application as well as the scientist. Thereby already the reviewer, who has been trained regarding the UKS screening, has an additional information on psychosocial strains of the applicant which can be consulted for the referral decision.;;;Primary Sponsor;Institut für Rehabilitationsmedizin,Medizinische Fakultät der Martin-Luther-Universität Halle;Wilfried;Mau;Contact for Scientific Queries;Institut für Rehabilitationsmedizin,Medizinische Fakultät der Martin-Luther-Universität Halle;Wilfried;Mau;540;Recruiting complete, follow-up complete;yes;Multicenter trial;;;;;;;;;;;;;;;
178;208;DRKS00009883;Hamburg;1;Hamburg;10.1186/s12885-016-2896-7 ;;yes;08.11.2016;no;;;Effectiveness of a structured intervention to improve nutritional behavior of young patients after cancer in childhood, adolescence and young adulthood (AYAs) with cardiovascular risk - a pilot study in context of the Survivorship Program of University Cancer Center Hamburg in cooperation with the University Neubrandenburg - INAYA study (Improved Nutrition in AYAs);2016-03-10;2015/06/01;Actual;2015/10/08;Arm 1;After the consultation hour for cancer survivors in the UCCH the patients of the intervention group will be 45 minutes comprehensively and individual advised by a dietitian, based on healthy eating recommendations of the German Food Association (DGE). In context of a “Baseline Assessment” the patients current nutrition behavior, as well as demographical, disease-related and biochemical parameter will be registered. After two and six weeks the dietitian contacts the patient for another consultation by phone. After 12 weeks there will be a final discussion including an “Endpoint Assessment” where the patient receives another questionnaire (HEI).;;;;;Primary Sponsor;Universitätsklinikum Hamburg-Eppendorf;[---]*;[---]*;Contact for Scientific Queries;Hubertus Wald Tumorzentrum, Universitäres Cancer Center Hamburg, II. Medizinische Klinik und Poliklinik, Universitätsklinikum Hamburg-Eppendorf (UKE), Haus O24;Julia;Quidde;21;Recruiting complete, follow-up complete;yes;Monocenter trial;Paper;https://www.ncbi.nlm.nih.gov/pmc/articles/PMC5101649/;https://www.ncbi.nlm.nih.gov/pmc/articles/PMC5101649/;;;;;;;;;;;;
410;220;DRKS00005159;Hannover;3;Hannover;10.1177/2047487319849505 ;;unclear;13.05.2019;yes;very short article, there is a longer article one year later (https://doi.org/10.1186/s12995-020-00261-4), not sure which one to count. But in case of doubt the earlier publ should be taken I guess;;Improvement of endogenous regeneration in female healthy volunteers through physical exercise “REBIRTH aktiv women”;2013-09-25;2013/11/20;Actual;2015/03/26;Arm 1;Training intervention of 210 min per week over a period of 6 months. Training could be bicycling, ergometer training, swimming, walking, nordic-walking, jogging, running, rowing-ergometer, shoulder-arm-ergometer. Also daily activities will be relevant as physical activities.;Arm 2;Waiting-control group of half of the study participants.;;;Primary Sponsor;MHH - HTTG Chirurgie;Axel;Haverich;Contact for Scientific Queries;Medizinische Hochschule Hannover;Uwe;Tegtbur;313;Recruiting complete, follow-up complete;yes;Monocenter trial;;;;;;;;;;;;;;;
196;243;DRKS00006206;Heidelberg;1;Heidelberg;10.1016/j.mhp.2016.03.002 ;;yes;03.03.2016;no;;;Evaluating a stress prevention programme for sixth form pupils;2014-07-01;2014/03/24;Actual;2014/12/31;Arm 1;Intervention Group. The stress prevention programme will be conducted in the school setting and substitute regular sports lessons for pupils of the intervention group. Pupils will work on the topics stress and coping, class climate and peer relations as well as exam situations and worries about the future. The training contains psychoeducation as well as experience-based education. It encompasses three sessions of 90 minutes each.<br/>;Arm 2;Wait list control group. Pupils of the wait list comparison will attend regular sports classes while the programme is carried out in the intervention group. After postline assessment the wait list control group will be given the opportunity to participate in the stress prevention programme as well.;;;Primary Sponsor;Kinder- und Jugendpsychiatrie Heidelberg Zentrum für Psychosoziale Medizin;Franz;Resch;Contact for Scientific Queries;Kinder- und Jugendpsychiatrie HeidelbergZentrum für Psychosoziale Medizin;Michael;Kaess;300;Recruiting complete, follow-up complete;yes;Monocenter trial;Paper;http://www.sciencedirect.com/science/article/pii/S2212657015300118;Eppelmann, L., Parzer, P., Lenzen, C., Bürger, A., Haffner, J., Resch, F., & Kaess, M. (2016). Stress, coping and emotional and behavioral problems among German high school students. Mental Health & Prevention. https://doi.org/10.1016/j.mhp.2016.03.002;;;;;;;;;;;;
305;14;DRKS00011600;Bochum;2;Bochum;10.1016/j.jcrs.2017.04.038 ;https://pubmed.ncbi.nlm.nih.gov/28823444/;yes;01.07.2017;no;;Zeitpunkt des primären Outcomes verändert (6 statt 3 Monate post-OP). ;Evaluation of Clinical Acceptability of the IC-8 Intraocular Lens;2017-01-25;2015/03/03;Actual;2016/11/10;Arm 1;"Appropriate patients are included in the study after signing the patient consent form. A total of 10 study visits will be necessary:<br/><br/>Preoperative examination of both eyes, first eye surgery (monofocale intraocular lens), examination 1 day after surgery first eye, examination 1 week after surgery first eye, second eye surgery (study lens IC-8, Acufocus), examination 1 day after surgery second eye, examination 1 week after surgery second eye, examination 1 month after surgery second eye,<br/>Examination 3 months after surgery second eye, examination 6 months after surgery second eye<br/><br/><br/>The following examinations are carried out on the preoperative visit:: ocular health and history;visual acuities; manifest refraction; pupil size (mesopic, photopic, and dilated); keratometry; biomicroscopic slit-lamp findings; visual symptoms; biometry (e.g., axial length, ACD, lens thickness, white to white, and IOL power calculation); ocular dominance;  applanation intraocular pressure; dilated fundus exam; potential acuity assessment; subjective questionnaire.<br/>Postoperative visits will assess visual outcomes including: visual acuities; manifest refraction; defocus curves; keratometry; applanation intraocular pressure; slit-lamp findings; visual symptoms; dilated fundus exam; AcuTarget (subgroup only); mesoptometer (subgroup only); visual field test (subgroup only),<br/>subjective questionnaires, and an investigator survey. All examinations with the exception of the AcuTarget measurement and the subjective patient questionnaire, are considered routine, non-invasive assessments after cataract surgery.<br/>";;;;;Primary Sponsor;AcuFocus Inc.;Michael;Bonilla;Contact for Scientific Queries;Universitätsklinikum Knappschaftskrankenhaus Bochum GmbH Augenklinik;H. Burkhard;Dick;130;Recruiting complete, follow-up complete;no;Multicenter trial;;;;;;;;;;;;;;;
